{
  "key": "guardian-multiclass-improvement",
  "name": "Guardian Multiclass Improvement",
  "className": "Guardian",
  "improvementType": "multiclass",
  "prerequisite": "At least 3 levels in guardian",
  "description": "You can add half your other chosen class's levels (rounded down) to your guardian levels when determining your amount of Focused Strikes dice and your number of uses of Channel the Force.",
  "sourceKey": "ec",
  "contentSet": "expanded-content"
}
